{
  "$schema": "../schemas/azd-gui.catalog.schema.json",
  "schemaVersion": "1.0",
  "id": "bundled",
  "title": "Vetted deployments",
  "entries": [
    {
      "id": "myworkid",
      "title": "MyWorkID",
      "summary": "Discover and secure identities that can access Microsoft 365 and Azure.",
      "description": "A cross-platform deployment with conditional collection, reporting, and Microsoft Graph options.",
      "repository": "https://github.com/nathanmcnulty/azd-myworkid",
      "commit": "0a6f0aedbfd2bc3fee47b10f37fda47ed744286c",
      "tags": ["Identity", "Microsoft Graph", "App Service"],
      "platforms": ["windows", "macos", "linux"],
      "manifest": "manifests/myworkid.json"
    },
    {
      "id": "maester-automation",
      "title": "Maester — Automation Account",
      "summary": "Schedule Maester security tests with Azure Automation.",
      "description": "A pinned deployment choice from the automation-account subdirectory.",
      "repository": "https://github.com/nathanmcnulty/azd-maester",
      "commit": "1692b2e5a69c414b1e204c2714281ba0085c3560",
      "subdirectory": "automation-account",
      "tags": ["Maester", "Security", "Automation"],
      "platforms": ["windows", "macos", "linux"],
      "manifest": "manifests/maester-automation.json"
    },
    {
      "id": "entra-health-monitoring",
      "title": "Entra Health Monitoring",
      "summary": "Deploy tenant health collection and reporting resources.",
      "description": "A Windows-specific deployment using Azure CLI for Microsoft Graph setup.",
      "repository": "https://github.com/nathanmcnulty/azd-entra-health-monitoring",
      "commit": "6bc4790be80fb902072d164b9d91268922cd5195",
      "tags": ["Entra", "Health", "Monitoring"],
      "platforms": ["windows"],
      "manifest": "manifests/entra-health-monitoring.json"
    },
    {
      "id": "deployment-check",
      "title": "Azure deployment check",
      "summary": "Start with one empty resource group to check your deployment setup.",
      "description": "Creates one resource group and validates access in your selected subscription. No applications, identities, or role assignments. Use a new environment name and remove the dedicated group when finished; cleanup deletes anything later placed in it.",
      "repository": "https://github.com/nathanmcnulty/azd-reference",
      "commit": "abc6e896620990e68360a63dd14efda66a3f75cd",
      "subdirectory": "examples/deployment-check",
      "tags": ["Start here", "Azure", "Validation"],
      "platforms": ["windows"],
      "manifest": "manifests/deployment-check.json"
    }
  ]
}
